{
  "$schema": "https://json-schema.org/draft/2020-12/schema",
  "$id": "https://athanor.dev/schema/chunk.schema.json",
  "title": "Athanor Chunk",
  "description": "The atomic unit of the Athanor protocol: a typed, attributed fragment of knowledge, behavior, preference, or experience.",
  "type": "object",
  "required": [
    "chunk_id",
    "author",
    "cluster",
    "type",
    "uniqueness",
    "source",
    "confidence",
    "content"
  ],
  "properties": {
    "chunk_id": {
      "type": "string",
      "pattern": "^[A-Z]{2,4}-[A-Z]{3,5}-\\d{3}$",
      "description": "Unique identifier in the format CLUSTER-TYPE-NNN."
    },
    "author": {
      "type": "string",
      "minLength": 1,
      "description": "The subject to whom this chunk is attributed."
    },
    "cluster": {
      "type": "string",
      "minLength": 1,
      "description": "The thematic cluster this chunk belongs to."
    },
    "type": {
      "type": "string",
      "enum": [
        "heuristic",
        "anti-pattern",
        "preference",
        "belief",
        "fact",
        "skill",
        "emotion",
        "story",
        "contradiction",
        "style",
        "framework",
        "rant",
        "meta",
        "ritual",
        "hard_rule"
      ],
      "description": "The chunk type classification."
    },
    "uniqueness": {
      "type": "string",
      "enum": ["CRITICAL", "HIGH", "MEDIUM"],
      "description": "How distinctive this chunk is to the subject versus the general population."
    },
    "source": {
      "type": "string",
      "enum": [
        "interview",
        "email",
        "document",
        "code",
        "meeting",
        "chat",
        "social",
        "observation",
        "inferred",
        "second_order_analysis"
      ],
      "description": "The provenance category from which this chunk was extracted."
    },
    "confidence": {
      "type": "number",
      "minimum": 0.0,
      "maximum": 1.0,
      "description": "Extraction certainty score from 0.0 (speculative) to 1.0 (directly stated)."
    },
    "context_tags": {
      "type": "array",
      "items": {
        "type": "string",
        "minLength": 1
      },
      "default": [],
      "description": "Free-form tags for situational retrieval."
    },
    "linked_chunks": {
      "type": "array",
      "items": {
        "type": "string",
        "pattern": "^[A-Z]{2,4}-[A-Z]{3,5}-\\d{3}$"
      },
      "default": [],
      "description": "Lightweight, untyped references to other chunk identifiers."
    },
    "content": {
      "type": "string",
      "minLength": 20,
      "description": "The substantive content of the chunk. Must be self-contained and at least 20 characters."
    }
  },
  "additionalProperties": false
}
